{
  "schema_version": "9709_math_question_v2",
  "paper_code": "9709_w25_53",
  "question_id": "9709_w25_53_q7",
  "question_num": 7,
  "subject_code": "9709",
  "component": "S1",
  "year": 2025,
  "session": "Oct/Nov",
  "variant": "53",
  "question_stem": "The times taken by Obi to walk to work each morning are normally distributed with mean 14.8 minutes and standard deviation 1.5 minutes.",
  "context_texts": [],
  "total_marks": 10,
  "figures": [],
  "parts": [
    {
      "id": "9709_w25_53_q7_a",
      "path": [
        "a"
      ],
      "label": "(a)",
      "parent_id": null,
      "display_order": 1,
      "question_text": "Find the probability that, on a randomly chosen day, Obi takes more than 15.6 minutes to walk to work.",
      "marks": 3,
      "answer_type": "math-with-working",
      "figure_ids": [],
      "dependencies": [],
      "response_schema": {
        "version": "0.1",
        "blocks": [
          {
            "block_id": "9709_w25_53_q7_a_block_01",
            "type": "fields",
            "fields": [
              {
                "field_id": "9709_w25_53_q7_a_field_01",
                "control": "math_working",
                "role": "answer_with_working",
                "required": true
              }
            ]
          }
        ]
      }
    },
    {
      "id": "9709_w25_53_q7_b",
      "path": [
        "b"
      ],
      "label": "(b)",
      "parent_id": null,
      "display_order": 2,
      "question_text": "On 90% of days, Obi takes more than $t$ minutes to walk to work.\n\nFind the value of $t$.",
      "marks": 3,
      "answer_type": "math-with-working",
      "figure_ids": [],
      "dependencies": [],
      "response_schema": {
        "version": "0.1",
        "blocks": [
          {
            "block_id": "9709_w25_53_q7_b_block_01",
            "type": "fields",
            "fields": [
              {
                "field_id": "9709_w25_53_q7_b_field_01",
                "control": "math_working",
                "role": "answer_with_working",
                "required": true
              }
            ]
          }
        ]
      }
    },
    {
      "id": "9709_w25_53_q7_c",
      "path": [
        "c"
      ],
      "label": "(c)",
      "parent_id": null,
      "display_order": 3,
      "question_text": "On how many days in a year would you expect Obi to take within one minute of the mean time to walk to work?",
      "marks": 4,
      "answer_type": "math-with-working",
      "figure_ids": [],
      "dependencies": [],
      "response_schema": {
        "version": "0.1",
        "blocks": [
          {
            "block_id": "9709_w25_53_q7_c_block_01",
            "type": "fields",
            "fields": [
              {
                "field_id": "9709_w25_53_q7_c_field_01",
                "control": "math_working",
                "role": "answer_with_working",
                "required": true
              }
            ]
          }
        ]
      },
      "part_stem": "Obi walks to work 5 days a week for 45 weeks in a year."
    }
  ],
  "content_flow": [
    {
      "type": "part",
      "part_id": "9709_w25_53_q7_a"
    },
    {
      "type": "part",
      "part_id": "9709_w25_53_q7_b"
    },
    {
      "type": "part",
      "part_id": "9709_w25_53_q7_c"
    }
  ],
  "verification": {
    "content_structure_checked": true,
    "marks_reconciled": true,
    "numerical_values_checked": false
  }
}
