{
  "schema_version": "9709_math_question_v2",
  "paper_code": "9709_w22_11",
  "question_id": "9709_w22_11_q8",
  "question_num": 8,
  "subject_code": "9709",
  "component": "P1",
  "year": 2022,
  "session": "Oct/Nov",
  "variant": "11",
  "question_stem": "The function f is defined by $f(x) = 2 - \\frac{3}{4x-p}$ for $x > \\frac{p}{4}$, where $p$ is a constant.",
  "context_texts": [],
  "total_marks": 8,
  "figures": [],
  "parts": [
    {
      "id": "9709_w22_11_q8_a",
      "path": [
        "a"
      ],
      "label": "(a)",
      "parent_id": null,
      "display_order": 1,
      "question_text": "Find $f'(x)$ and hence determine whether f is an increasing function, a decreasing function or neither.",
      "marks": 3,
      "answer_type": "math-with-working",
      "figure_ids": [],
      "dependencies": [],
      "response_schema": {
        "version": "0.1",
        "blocks": [
          {
            "block_id": "9709_w22_11_q8_a_block_01",
            "type": "fields",
            "fields": [
              {
                "field_id": "9709_w22_11_q8_a_field_01",
                "control": "math_working",
                "role": "answer_with_working",
                "required": true
              }
            ]
          }
        ]
      }
    },
    {
      "id": "9709_w22_11_q8_b",
      "path": [
        "b"
      ],
      "label": "(b)",
      "parent_id": null,
      "display_order": 2,
      "question_text": "Express $f^{-1}(x)$ in the form $\\frac{p}{a} - \\frac{b}{cx - d}$, where $a$, $b$, $c$ and $d$ are integers.",
      "marks": 4,
      "answer_type": "math-with-working",
      "figure_ids": [],
      "dependencies": [],
      "response_schema": {
        "version": "0.1",
        "blocks": [
          {
            "block_id": "9709_w22_11_q8_b_block_01",
            "type": "fields",
            "fields": [
              {
                "field_id": "9709_w22_11_q8_b_field_01",
                "control": "math_working",
                "role": "answer_with_working",
                "required": true
              }
            ]
          }
        ]
      }
    },
    {
      "id": "9709_w22_11_q8_c",
      "path": [
        "c"
      ],
      "label": "(c)",
      "parent_id": null,
      "display_order": 3,
      "question_text": "Hence state the value of $p$ for which $f^{-1}(x) \\equiv f(x)$.",
      "marks": 1,
      "answer_type": "math-with-working",
      "figure_ids": [],
      "dependencies": [
        {
          "type": "question_context",
          "part_id": "9709_w22_11_q8_b"
        }
      ],
      "response_schema": {
        "version": "0.1",
        "blocks": [
          {
            "block_id": "9709_w22_11_q8_c_block_01",
            "type": "fields",
            "fields": [
              {
                "field_id": "9709_w22_11_q8_c_field_01",
                "control": "math_working",
                "role": "answer_with_working",
                "required": true
              }
            ]
          }
        ]
      }
    }
  ],
  "content_flow": [
    {
      "type": "part",
      "part_id": "9709_w22_11_q8_a"
    },
    {
      "type": "part",
      "part_id": "9709_w22_11_q8_b"
    },
    {
      "type": "part",
      "part_id": "9709_w22_11_q8_c"
    }
  ],
  "verification": {
    "content_structure_checked": true,
    "marks_reconciled": true,
    "numerical_values_checked": false
  }
}
