{
  "schema_version": "9709_math_question_v2",
  "paper_code": "9709_w19_42",
  "question_id": "9709_w19_42_q5",
  "question_num": 5,
  "subject_code": "9709",
  "component": "M1",
  "year": 2019,
  "session": "Oct/Nov",
  "variant": "42",
  "question_stem": "Two particles $A$ and $B$ move in the same vertical line. Particle $A$ is projected vertically upwards from the ground with speed $20 \\text{ m s}^{-1}$. One second later particle $B$ is dropped from rest from a height of $40 \\text{ m}$.",
  "context_texts": [
    "$8.75\\text{ m}$"
  ],
  "total_marks": 7,
  "figures": [],
  "parts": [
    {
      "id": "9709_w19_42_q5_i",
      "path": [
        "i"
      ],
      "label": "(i)",
      "parent_id": null,
      "display_order": 1,
      "question_text": "Find the height above the ground at which the two particles collide.",
      "marks": 4,
      "answer_type": "math-with-working",
      "figure_ids": [],
      "dependencies": [],
      "response_schema": {
        "version": "0.1",
        "blocks": [
          {
            "block_id": "9709_w19_42_q5_i_block_01",
            "type": "fields",
            "fields": [
              {
                "field_id": "9709_w19_42_q5_i_field_01",
                "control": "math_working",
                "role": "answer_with_working",
                "required": true
              }
            ]
          }
        ]
      }
    },
    {
      "id": "9709_w19_42_q5_ii",
      "path": [
        "ii"
      ],
      "label": "(ii)",
      "parent_id": null,
      "display_order": 2,
      "question_text": "Find the difference in the speeds of the two particles at the instant when the collision occurs.",
      "marks": 3,
      "answer_type": "math-with-working",
      "figure_ids": [],
      "dependencies": [
        {
          "type": "question_context",
          "part_id": "9709_w19_42_q5_i"
        }
      ],
      "response_schema": {
        "version": "0.1",
        "blocks": [
          {
            "block_id": "9709_w19_42_q5_ii_block_01",
            "type": "fields",
            "fields": [
              {
                "field_id": "9709_w19_42_q5_ii_field_01",
                "control": "math_working",
                "role": "answer_with_working",
                "required": true
              }
            ]
          }
        ]
      }
    }
  ],
  "content_flow": [
    {
      "type": "part",
      "part_id": "9709_w19_42_q5_i"
    },
    {
      "type": "part",
      "part_id": "9709_w19_42_q5_ii"
    }
  ],
  "verification": {
    "content_structure_checked": true,
    "marks_reconciled": true,
    "numerical_values_checked": false
  }
}
