{
  "schema_version": "9709_math_question_v2",
  "paper_code": "9709_s25_43",
  "question_id": "9709_s25_43_q2",
  "question_num": 2,
  "subject_code": "9709",
  "component": "M1",
  "year": 2025,
  "session": "May/June",
  "variant": "43",
  "question_stem": "A van of mass $4500\\text{ kg}$ is towing a trailer of mass $350\\text{ kg}$ along a straight horizontal road. The van and trailer are connected by a light rigid tow-bar which is parallel to the road. There are resistance forces of $X\\text{ N}$ on the van and $120\\text{ N}$ on the trailer. The driving force produced by the van's engine is $2500\\text{ N}$. The tension in the tow-bar is $T\\text{ N}$, and the acceleration of the van is $0.4\\text{ m s}^{-2}$.",
  "context_texts": [],
  "total_marks": 4,
  "figures": [],
  "parts": [
    {
      "id": "9709_s25_43_q2",
      "path": [],
      "label": "",
      "parent_id": null,
      "display_order": 1,
      "question_text": "Find the value of $X$ and the value of $T$.",
      "marks": 4,
      "answer_type": "math-with-working",
      "figure_ids": [],
      "dependencies": [],
      "response_schema": {
        "version": "0.1",
        "blocks": [
          {
            "block_id": "9709_s25_43_q2_block_01",
            "type": "fields",
            "fields": [
              {
                "field_id": "9709_s25_43_q2_field_01",
                "control": "math_working",
                "role": "answer_with_working",
                "required": true
              }
            ]
          }
        ]
      }
    }
  ],
  "content_flow": [
    {
      "type": "part",
      "part_id": "9709_s25_43_q2"
    }
  ],
  "verification": {
    "content_structure_checked": true,
    "marks_reconciled": true,
    "numerical_values_checked": false
  }
}
