{
  "schema_version": "9709_math_question_v2",
  "paper_code": "9709_m21_42",
  "question_id": "9709_m21_42_q6",
  "question_num": 6,
  "subject_code": "9709",
  "component": "M1",
  "year": 2021,
  "session": "Feb/March",
  "variant": "42",
  "question_stem": "A particle moves in a straight line. It starts from rest from a fixed point $O$ on the line. Its velocity at time $t$ s after leaving $O$ is $v$ m s$^{-1}$, where $$v = t^2 - 8t^{\\frac{3}{2}} + 10t.$$",
  "context_texts": [],
  "total_marks": 11,
  "figures": [],
  "parts": [
    {
      "id": "9709_m21_42_q6_a",
      "path": [
        "a"
      ],
      "label": "(a)",
      "parent_id": null,
      "display_order": 1,
      "question_text": "Find the displacement of the particle from $O$ when $t = 1$.",
      "marks": 4,
      "answer_type": "math-with-working",
      "figure_ids": [],
      "dependencies": [],
      "response_schema": {
        "version": "0.1",
        "blocks": [
          {
            "block_id": "9709_m21_42_q6_a_block_01",
            "type": "fields",
            "fields": [
              {
                "field_id": "9709_m21_42_q6_a_field_01",
                "control": "math_working",
                "role": "answer_with_working",
                "required": true
              }
            ]
          }
        ]
      }
    },
    {
      "id": "9709_m21_42_q6_b",
      "path": [
        "b"
      ],
      "label": "(b)",
      "parent_id": null,
      "display_order": 2,
      "question_text": "Show that the minimum velocity of the particle is $-125$ m s$^{-1}$.",
      "marks": 7,
      "answer_type": "extended-text",
      "figure_ids": [],
      "dependencies": [],
      "response_schema": {
        "version": "0.1",
        "blocks": [
          {
            "block_id": "9709_m21_42_q6_b_block_01",
            "type": "fields",
            "fields": [
              {
                "field_id": "9709_m21_42_q6_b_field_01",
                "control": "long_text",
                "role": "answer_with_working",
                "required": true
              }
            ]
          }
        ]
      }
    }
  ],
  "content_flow": [
    {
      "type": "part",
      "part_id": "9709_m21_42_q6_a"
    },
    {
      "type": "part",
      "part_id": "9709_m21_42_q6_b"
    }
  ],
  "verification": {
    "content_structure_checked": true,
    "marks_reconciled": true,
    "numerical_values_checked": false
  }
}
